{
  "templateVersion": "1.0.0",
  "ontologyVersion": "1.0.0",
  "task": "MACRO_PRIORITY",
  "blueprintCatalog": {
    "contexts": {
      "complete": {"observedAtGameSecond": 900, "freshnessSeconds": 3, "completeness": 0.96, "uncertainFields": [], "availableFields": ["objectiveState", "waveState", "visionState", "numbersState", "teamPlan"], "stateSignature": "macro_state_current"},
      "stale": {"observedAtGameSecond": 900, "freshnessSeconds": 45, "completeness": 0.96, "uncertainFields": [], "availableFields": ["objectiveState", "waveState", "visionState", "numbersState", "teamPlan"], "stateSignature": "macro_state_stale"},
      "incomplete": {"observedAtGameSecond": 900, "freshnessSeconds": 3, "completeness": 0.55, "uncertainFields": ["objectiveState"], "availableFields": ["waveState", "visionState", "teamPlan"], "stateSignature": "macro_state_partial"}
    },
    "teamPlans": {
      "macro": {"primaryWinCondition": "MACRO_CONVERSION", "winConditionTags": ["MACRO"], "missingFunctions": ["VISION_CONTROL"], "coveredFunctions": ["WAVE_CLEAR"]}
    },
    "evidence": {
      "fresh": [{"role": "primary", "category": "OBSERVED_RUNTIME", "confidence": 0.95, "freshnessSeconds": 2, "conflictsWithRoles": []}],
      "conflicting": [{"role": "primary", "category": "OBSERVED_RUNTIME", "confidence": 0.94, "freshnessSeconds": 2, "conflictsWithRoles": ["secondary"]}, {"role": "secondary", "category": "DERIVED_RUNTIME", "confidence": 0.92, "freshnessSeconds": 2, "conflictsWithRoles": ["primary", "tertiary"]}, {"role": "tertiary", "category": "STRATEGIC_KNOWLEDGE", "confidence": 0.9, "freshnessSeconds": 2, "conflictsWithRoles": ["secondary"]}]
    },
    "threats": {
      "macro": [{"role": "primary", "priority": 0.9, "patterns": ["BACKLINE_ACCESS"]}]
    },
    "candidates": {
      "setup": [{"role": "preferred", "actionType": "SETUP_VISION", "evidenceRoles": ["primary"], "feasibility": 0.96, "supportsFunctions": ["VISION_CONTROL"], "counteredThreatRoles": ["primary"], "winConditionTags": ["MACRO"], "urgencyAlignment": 0.95, "opportunityCost": 0.05, "executionBurden": 0.05, "equivalenceKey": "macro_setup"}, {"role": "alternative", "actionType": "HOLD", "evidenceRoles": ["primary"], "feasibility": 0.65, "supportsFunctions": [], "counteredThreatRoles": [], "winConditionTags": [], "urgencyAlignment": 0.2, "opportunityCost": 0.55, "executionBurden": 0.1, "equivalenceKey": "macro_hold"}],
      "wave": [{"role": "preferred", "actionType": "PUSH_FAST", "evidenceRoles": ["primary"], "feasibility": 0.96, "supportsFunctions": ["WAVE_CLEAR"], "counteredThreatRoles": ["primary"], "winConditionTags": ["MACRO"], "urgencyAlignment": 0.95, "opportunityCost": 0.05, "executionBurden": 0.05, "equivalenceKey": "macro_wave"}, {"role": "alternative", "actionType": "HOLD", "evidenceRoles": ["primary"], "feasibility": 0.6, "supportsFunctions": [], "counteredThreatRoles": [], "winConditionTags": [], "urgencyAlignment": 0.2, "opportunityCost": 0.6, "executionBurden": 0.1, "equivalenceKey": "macro_hold"}],
      "rotate": [{"role": "preferred", "actionType": "ROTATE", "evidenceRoles": ["primary"], "feasibility": 0.96, "supportsFunctions": ["VISION_CONTROL"], "counteredThreatRoles": ["primary"], "winConditionTags": ["MACRO"], "urgencyAlignment": 0.95, "opportunityCost": 0.05, "executionBurden": 0.05, "equivalenceKey": "macro_rotate"}, {"role": "alternative", "actionType": "HOLD", "evidenceRoles": ["primary"], "feasibility": 0.6, "supportsFunctions": [], "counteredThreatRoles": [], "winConditionTags": [], "urgencyAlignment": 0.2, "opportunityCost": 0.6, "executionBurden": 0.1, "equivalenceKey": "macro_hold"}],
      "recall": [{"role": "preferred", "actionType": "RECALL", "evidenceRoles": ["primary"], "feasibility": 0.96, "supportsFunctions": ["VISION_CONTROL"], "counteredThreatRoles": ["primary"], "winConditionTags": ["MACRO"], "urgencyAlignment": 0.95, "opportunityCost": 0.05, "executionBurden": 0.05, "equivalenceKey": "macro_recall"}, {"role": "alternative", "actionType": "STAY", "evidenceRoles": ["primary"], "feasibility": 0.6, "supportsFunctions": [], "counteredThreatRoles": [], "winConditionTags": [], "urgencyAlignment": 0.2, "opportunityCost": 0.6, "executionBurden": 0.1, "equivalenceKey": "macro_stay"}],
      "side": [{"role": "preferred", "actionType": "SPLIT", "evidenceRoles": ["primary"], "feasibility": 0.96, "supportsFunctions": ["SIDE_LANE_PRESSURE"], "counteredThreatRoles": ["primary"], "winConditionTags": ["MACRO"], "urgencyAlignment": 0.95, "opportunityCost": 0.05, "executionBurden": 0.05, "equivalenceKey": "macro_side"}, {"role": "alternative", "actionType": "GROUP", "evidenceRoles": ["primary"], "feasibility": 0.6, "supportsFunctions": [], "counteredThreatRoles": [], "winConditionTags": [], "urgencyAlignment": 0.2, "opportunityCost": 0.6, "executionBurden": 0.1, "equivalenceKey": "macro_group"}],
      "trade": [{"role": "preferred", "actionType": "TRADE_OBJECTIVE", "evidenceRoles": ["primary"], "feasibility": 0.96, "supportsFunctions": ["OBJECTIVE_DAMAGE"], "counteredThreatRoles": ["primary"], "winConditionTags": ["MACRO"], "urgencyAlignment": 0.95, "opportunityCost": 0.05, "executionBurden": 0.05, "equivalenceKey": "macro_trade"}, {"role": "alternative", "actionType": "CONTEST_OBJECTIVE", "evidenceRoles": ["primary"], "feasibility": 0.55, "supportsFunctions": [], "counteredThreatRoles": [], "winConditionTags": [], "urgencyAlignment": 0.3, "opportunityCost": 0.7, "executionBurden": 0.6, "equivalenceKey": "macro_contest"}],
      "equal": [{"role": "preferred", "actionType": "ROTATE", "evidenceRoles": ["primary"], "feasibility": 0.8, "supportsFunctions": ["VISION_CONTROL"], "counteredThreatRoles": ["primary"], "winConditionTags": ["MACRO"], "urgencyAlignment": 0.7, "opportunityCost": 0.2, "executionBurden": 0.2, "equivalenceKey": "macro_equal"}, {"role": "alternative", "actionType": "SETUP_VISION", "evidenceRoles": ["primary"], "feasibility": 0.8, "supportsFunctions": ["VISION_CONTROL"], "counteredThreatRoles": ["primary"], "winConditionTags": ["MACRO"], "urgencyAlignment": 0.7, "opportunityCost": 0.2, "executionBurden": 0.2, "equivalenceKey": "macro_equal"}],
      "none": [{"role": "preferred", "actionType": "HOLD", "evidenceRoles": ["primary"], "feasibility": 0.0, "supportsFunctions": [], "counteredThreatRoles": [], "winConditionTags": [], "urgencyAlignment": 0.0, "opportunityCost": 0.9, "executionBurden": 0.9, "equivalenceKey": "macro_none"}, {"role": "alternative", "actionType": "ROTATE", "evidenceRoles": ["primary"], "feasibility": 0.0, "supportsFunctions": [], "counteredThreatRoles": [], "winConditionTags": [], "urgencyAlignment": 0.0, "opportunityCost": 0.9, "executionBurden": 0.9, "equivalenceKey": "macro_none_alt"}]
    },
    "recentAdvice": {
      "none": [],
      "repeated": [{"actionRole": "preferred", "equivalenceKey": "macro_rotate", "ageSeconds": 5, "decision": "SHOW", "stateSignature": "macro_state_current"}]
    }
  },
  "families": [
    {"familyId":"macro_objective_setup","task":"MACRO_PRIORITY","description":"Prepare the objective area before commitment.","invariantPrinciple":"Setup precedes a contest when preparation value is declared.","splitGroup":"macro_objective","sourceEligibility":["SYNTHETIC","COUNTERFACTUAL"],"parameterRanges":{"contextProfile":"complete","teamPlanProfile":"macro","seed":{"minimum":1,"maximum":1000}},"requiredContextFields":["objectiveState","waveState","visionState","numbersState","teamPlan"],"evidenceBlueprints":{"profile":"fresh"},"threatBlueprints":{"profile":"macro"},"candidateBlueprints":{"profile":"setup"},"recentAdviceBlueprint":{"profile":"none"},"expectedDecisionConstraints":{"decisions":["SHOW"],"triggeredGates":["showCandidate"],"selectedCandidateRoles":["preferred"]},"allowedReasonCodes":["OBJECTIVE_SETUP","WAVE_WINDOW"],"counterfactualAxes":[{"id":"setup_value","description":"Change setup value.","field":"candidates.preferred.urgencyAlignment","values":[0.1,0.95]}],"adversarialAxes":[{"id":"label","description":"Rename action.","field":"candidates.preferred.actionId","values":["a","b"]}],"usefulChange":"Objective urgency or access changes materially.","insufficientChange":"Only the action wording changes.","semanticComparisonFields":["objectiveState","visionState","candidate.equivalenceKey"],"reenablingRecheckTriggers":["OBJECTIVE_STATE_CHANGED","VISION_STATE_CHANGED"],"messageIntents":["prepare_objective"],"minimumExamples":8,"maximumExamples":40},
    {"familyId":"macro_vision_before_contest","task":"MACRO_PRIORITY","description":"Establish vision before contesting.","invariantPrinciple":"Contest quality depends on reliable access information.","splitGroup":"macro_vision","sourceEligibility":["SYNTHETIC","COUNTERFACTUAL"],"parameterRanges":{"contextProfile":"complete","teamPlanProfile":"macro","seed":{"minimum":1,"maximum":1000}},"requiredContextFields":["objectiveState","visionState","numbersState","teamPlan"],"evidenceBlueprints":{"profile":"fresh"},"threatBlueprints":{"profile":"macro"},"candidateBlueprints":{"profile":"setup"},"recentAdviceBlueprint":{"profile":"none"},"expectedDecisionConstraints":{"decisions":["SHOW"],"triggeredGates":["showCandidate"],"selectedCandidateRoles":["preferred"]},"allowedReasonCodes":["OBJECTIVE_SETUP","VISION_GAP","WAVE_WINDOW"],"counterfactualAxes":[{"id":"vision_gap","description":"Change vision coverage.","field":"visionState.coverage","values":[0.2,0.9]}],"adversarialAxes":[{"id":"order","description":"Reverse candidate order.","field":"candidates.order","values":["forward","reverse"]}],"usefulChange":"Vision coverage or contest access changes.","insufficientChange":"An irrelevant observation is added.","semanticComparisonFields":["objectiveState","visionState","numbersState"],"reenablingRecheckTriggers":["VISION_STATE_CHANGED","OBJECTIVE_STATE_CHANGED"],"messageIntents":["vision_before_contest"],"minimumExamples":8,"maximumExamples":40},